,Unnamed: 0,id,label,text,triple
5941,5941.0,3966.json,False,Muslims tried to use Sharia law to influence court decisions in New Jersey and Oklahoma,NaN
5942,5942.0,1643.json,True,"Actually, Reagan was a Democrat before he was a Republican.",NaN
5943,5943.0,3018.json,False,We can save 125 billion in simply not giving out money to Medicare recipients that dont exist for procedures that didnt happen.,NaN
5944,5944.0,10590.json,False,The University of Wisconsin System will be much more affordable than just about any other campus in America because going forward we have a cap on it tied to inflation.,NaN
5945,5945.0,3429.json,False,Gov. Rick Perry used 3.2 billion in stimulus dollars for schools to plug other holes in his budget.,NaN
5946,5946.0,9631.json,True,On immigration reform,NaN
5947,5947.0,10249.json,True,The actions Im taking are the kinds of actions taken by every single Republican president and every single Democratic president for the past halfcentury.,NaN
5948,5948.0,6048.json,True,"It took us four years to balance the budget. Then I gave you four surplus budgets for the first time in more than 70 years, paid 600 billion down on the national debt.",NaN
5949,5949.0,6483.json,True,"Says Jon Corzine gave away 14 percent raises over 4 years and he stood on the front steps of the Capitol at a publicsector union rally and said, I will fight to get you a great contract.",NaN
5950,5950.0,11845.json,True,Weve cut taxes 50 times and look what has happened to our revenues. Theyve grown.,NaN
5951,5951.0,8380.json,True,Many dont know that Bill Young was once the minority leader in the Florida Senate...because he was the only Republican senator.,NaN
5952,5952.0,9389.json,False,Says Barack Obama is the only American president who has not visited the DDay Monument in Normandy on DDay.,NaN
5953,5953.0,6092.json,False,Says Oregon is one of only three states that allow the use of gillnets on inland waters.,NaN
5954,5954.0,11820.json,False,"Obamacare is the biggest jobkiller in this country  millions of Americans have lost their jobs, have been forced into parttime work.",NaN
5955,5955.0,12654.json,False,"Says Donald Trump made a lot of money from outsourcing jobs thanks to NAFTA but never, ever raised his voice against it when Congress was considering it.",NaN
5956,5956.0,390.json,True,Ive spent 20 years devoted to working on behalf of families who are having a tough time and are seeking out the American dream.,NaN
5957,5957.0,1830.json,False,Says he was a Marine during Vietnam.,NaN
5958,5958.0,1132.json,False,AARP is endorsing the health care reform bill.,NaN
5959,5959.0,6810.json,False,Says Mitt Romneys investments created zero jobs.,NaN
5960,5960.0,9000.json,True,"American Hustleshows the FBI making reallife bribes to Washington politicians. I know, because as your U.S. senator, I turned them down.",NaN
5961,5961.0,533.json,False,"These steps a middleclass tax cut, national health care plan, foreclosure prevention fund, Social Security fix and more are all paid for.",NaN
5962,5962.0,5936.json,False,Barack Obama and Hillary Clinton are negotiating with the United Nations about doing a treaty that will ban the use of firearms.,NaN
5963,5963.0,9509.json,False,"The nearly sixyear delay in approving Keystone is costing Americans more than 100,000 jobs.",NaN
5964,5964.0,3392.json,False,Says iPads and iPhones are built in the United States of America.,NaN
5965,5965.0,4084.json,False,"Dubious taxpayerfunded stimulus projects in Rhode Island include 250,000 to provide digital television to the states inmate population.",NaN
5966,5966.0,12915.json,False,The Pentagon itself says that we could eliminate 20 percent of U.S. bases.,NaN
5967,5967.0,2093.json,True,I never called for a partition of Iraq.,NaN
5968,5968.0,1818.json,False,"In the history department at the University of Texas, out of 50 registered voters, only one is a Republican.",NaN
5969,5969.0,2892.json,True,Said Republicans made historic gains in state legislatures during last months election,NaN
5970,5970.0,12658.json,True,We got the highest vote count in the history of the Republican Party.,NaN
5971,5971.0,5606.json,True,"Metro Atlantans spend over an hour every day or five hours a week commuting, for a total of 260 hours a year.",NaN
5972,5972.0,1625.json,True,In Cover Florida thousands already enrolled and climbing.,NaN
5973,5973.0,9275.json,True,The Cathedral of Christ the King is one of the Archdiocese of Atlantas largest and fastestgrowing parishes.,NaN
5974,5974.0,6168.json,False,New Jerseys citizens are working at the highest rate in three years.,NaN
5975,5975.0,1459.json,False,The money supply has doubled in the last year.,NaN
5976,5976.0,7644.json,False,"Says Oregons high minimum wage is the reason why by 2011, Oregons restaurants employed an average of only 13.8 workers, or 2.6 fewer employees than they did before the states minimum wage began rising above the federal level in 1997.",NaN
5977,5977.0,1014.json,True,The president of the United States ... agrees with me that marriage should be between a man and a woman.,NaN
5978,5978.0,4226.json,True,The debt ceiling deal will result in the lowest level of annual domestic spending since Dwight Eisenhower was president.,NaN
5979,5979.0,1363.json,False,The Climatic Research Unit emails show that the science behind climate change has been pretty well debunked.,NaN
5980,5980.0,5782.json,True,President Obamas suggested reduction in spending for next year 0.,NaN
5981,5981.0,4231.json,False,"Rick Perry ended fullday PreK for 100,000 Texas children.",NaN
5982,5982.0,7570.json,True,Says PPS employees have paid their own PERS contributions for many years.,NaN
5983,5983.0,10267.json,True,Every president since Eisenhower has taken executive action to address immigration issues.,NaN
5984,5984.0,2654.json,False,Says Alex Sinks plans for governor include 12.5 billion in new spending.,NaN
5985,5985.0,3397.json,False,"Any child born prematurely, according to the president, in his own words, can be killed.",NaN
5986,5986.0,8934.json,True,Seventy percent of all uninsured live in households in which at least one person is working.,NaN
5987,5987.0,2104.json,False,Recent data showed Nevada ranks 50th in the money received from the stimulus bill.,NaN
5988,5988.0,1346.json,True,"If you want to talk firsts for Bush, this was the first time in American history that a president took us into a war and cut taxes.",NaN
5989,5989.0,5241.json,False,Nearly half of all persons under 30 did not go to work today.,NaN
5990,5990.0,11644.json,False,Ted Cruz tried to ban contraception five times.,NaN
5991,5991.0,9496.json,True,I dont own a single stock or bond I have no savings accounts.,NaN
5992,5992.0,2037.json,True,Forty percent of the undocumented workers in this country entered the U.S. legally and overstayed their visa.,NaN
5993,5993.0,11334.json,True,Just about half of rural hospitals operate in the red in Virginia. They operate at a loss.,NaN
5994,5994.0,11078.json,False,Obama keeps talking about getting rid of all nuclear weapons. Hes already significantly reduced our capabilities there.,NaN
5995,5995.0,9363.json,True,"Milwaukee has seen an uptick in violence since 2010, and the only period of calm we get is when winter sets in.",NaN
5996,5996.0,9149.json,False,The numbers of people that support Obamacare and like it have been steadily dropping.,NaN
5997,5997.0,5991.json,True,"The region I represent, both currently and in the future, has more automotive plants than the entire state of California.",NaN
5998,5998.0,504.json,False,Obamas wife wrote a paper in college that said America was a nation founded on crime and hatred and that whites in America are ineradicably racist.,NaN
5999,5999.0,5943.json,True,"Says in U.S. Congress, members dont even have to be on the floor for debates or votes.",NaN
6000,6000.0,3565.json,False,"Says Gov. Rick Scott lost Florida 331,247 jobs.",NaN
6001,6001.0,8922.json,False,Says North Carolina Republican Senate candidate Thom Tillis supports a plan that would end Medicare as we know it.,NaN
6002,6002.0,9451.json,True,"In the 1950s and 1960s, the minimum wage was such that it would lift you out of poverty.",NaN
6003,6003.0,5006.json,False,"Says Freddie Mac, electric coops and credit unions are all government sponsored enterprises.",NaN
6004,6004.0,4156.json,True,Republican redistricting plans cut Democrat Nancy Nusbaum out of her state Senate district by a half a block.,NaN
6005,6005.0,1355.json,False,"When Obama was interviewed by American reporters in Asia, Not one of them asked me about Asia. Not one of them asked me about the economy.",NaN
6006,6006.0,10418.json,True,A strong majority of Americans support the Keystone XL pipeline.,NaN
6007,6007.0,2525.json,False,A majority of Wisconsinites opposed the government takeover of health care. But Russ Feingold voted for it anyway.,NaN
6008,6008.0,10850.json,True,The lack of an automatic braking system that could have prevented the Philadelphia Amtrak crash wasnt driven by a lack of funding. It just takes a while. They Congress just passed it in the recent past.,NaN
6009,6009.0,10504.json,False,Obama has chosen to deny the vicious antiSemitic motivation of the attack on a kosher Jewish grocery in Paris.,NaN
6010,6010.0,1104.json,True,"Only 15 percent of drug users are AfricanAmerican, yet 74 percent of all drug offenders sentenced to prison are black",NaN
6011,6011.0,248.json,False,"Gas prices have never been higher, and Exxon Mobils profits have never been higher.",NaN
6012,6012.0,10348.json,True,Were now the No. 1 producer of oil in the world. Weve surpassed Saudi Arabia.,NaN
6013,6013.0,6051.json,False,"Says As Mayor of Wilsonville, I drove TriMet out of town and replaced their bloated transit system with our own local bus line that offers better service and has saved our businesses millions of dollars.",NaN
6014,6014.0,1960.json,True,"If Rhode Island applied a 1percent sales tax on all items exempt from sales tax, the state would receive an additional 89,376,857.",NaN
6015,6015.0,1633.json,False,Did not vote for tax increases as a member of the West Miami City Commission.,NaN
6016,6016.0,3852.json,False,Were going to be looking at 8 billion a day that were going to be pouring into foreign countries in order to import that makeup fuel that were going to need to take the place of what we could have gotten out of the gulf.,NaN
6017,6017.0,11390.json,False,Birth control pioneer Margaret Sanger believed that people like me should be eliminated.,NaN
6018,6018.0,5025.json,False,Says a trash mound on U.S. 290 is 800 feet tall.,NaN
6019,6019.0,13001.json,True,"Under the current procedure, if someone on a terror watch list tries to buy a gun, authorities are notified.",NaN
6020,6020.0,6819.json,False,"One of the first states in the union to pass a voter ID bill was Rhode Island, 85 percent Democratic legislature.",NaN
6021,6021.0,6548.json,False,"In the past 27 months, President Barack Obama has created more privatesector jobs than in the Reagan recovery.",NaN
6022,6022.0,12213.json,True,States with the highest gun ownership rates also have the highest suicide rates.,NaN
6023,6023.0,958.json,True,I dont do earmarks. Ive never done one. Im not going to do one.,NaN
6024,6024.0,2346.json,True,"Likens Obamas predicament to 1982, saying, when Reagan just started out, unemployment was at exactly the same point. He was two years into his term. The unemployment was well over 10 percent, and it did come out of it.",NaN
6025,6025.0,5984.json,False,"Says Tom Barrett voted to ban 15 different kinds of guns, even a lot of common deer rifles.",NaN
6026,6026.0,4290.json,True,The governor having a meeting ... isnt covered by the open meetings act.,NaN
6027,6027.0,13492.json,False,Says he won the popular vote if you deduct the millions of people who voted illegally.,NaN
6028,6028.0,7477.json,True,Says his proposed education spending is the highest state funding level in Florida history.,NaN
6029,6029.0,558.json,False,"Email quotes Maureen Dowd column that Obama has received suspicious contributions from Saudi Arabia, Iran and China.",NaN
6030,6030.0,7595.json,True,Says 94 percent of Marco Rubios constituents support a universal background check.,NaN
6031,6031.0,6061.json,True,"Says Tommy Thompsons tax plan amounts to an average tax cut of almost 87,000 for the top 1 percent.",NaN
6032,6032.0,6951.json,False,"Says Connie Mack takes two homestead exemptions, directly contrary to Floridas Constitution.",NaN
6033,6033.0,1027.json,True,Nobody has ever escaped from one of our federal supermax prisons.,NaN
6034,6034.0,12655.json,False,"Says 220,000New Yorkers would have immediately benefitted had President Obamas executive action been affirmed.So almost a quarter million of our fellow New Yorkers who are hurting right now whose rights and opportunities were taken away by the Supreme Court.",NaN
6035,6035.0,1676.json,False,"The bill reported out of committee sets up a 50 billion slush fund that, while intended for resolving failing firms, is available for virtually any purpose that the treasury secretary sees fit.",NaN
6036,6036.0,1216.json,True,Barack Obama and the Democrats have proposed a tax for not having health insurance.,NaN
6037,6037.0,8632.json,False,"The priorities of more than threequarters of Americans are to increase the minimum wage, create a path to citizenship for illegal immigrants, and require background checks for gun buyers.",NaN
6038,6038.0,9563.json,True,We in this state saw more job creation in the last three years since Ive been governor than you saw in the whole eight years of Doyles time as governor.,NaN
6039,6039.0,8641.json,True,Onethird of all bank tellers are on public assistance.,NaN
6040,6040.0,309.json,True,Bill Clintons peace dividend . . . cut the military 25 and 30 percent.,NaN
6041,6041.0,5261.json,True,We wiped out a 3.6 billion deficit without raising taxes.,NaN
6042,6042.0,2664.json,True,Mr. Hurt would reopen that darn Medicare doughnut hole.,NaN
6043,6043.0,2780.json,True,Animal abuse is often an indicative trait of future acts of violence against humans.,NaN
6044,6044.0,2996.json,False,"Says that all those who do not answer directly to the president, theyve said repealing Dont Ask, Dont Tell is a terrible idea.",NaN
6045,6045.0,5872.json,True,There has not been a Democratic woman in Congress from New Jersey in almost four decades.,NaN
6046,6046.0,3734.json,True,The Obama administration increased the deportation of illegal immigrants convicted of crimes by 70 percent.,NaN
6047,6047.0,11356.json,True,"Six of the 10 richest counties in the United States surround Washington, D.C.",NaN
6048,6048.0,13394.json,True,"The FBI has reopened its investigation into Hillary Clinton ... and discovered another 650,000 emails.",NaN
6049,6049.0,998.json,True,"About halfway through fiscal year 2009, Washington has run out of money.",NaN
6050,6050.0,1528.json,False,Says shes tried over 100 jury cases in Travis County courts.,NaN
6051,6051.0,13215.json,True,Kelly Ayotte voted to give big oil more than 20 billion in tax breaks.,NaN
6052,6052.0,5709.json,True,The average age of members of the House of Representatives is 57 years old.,NaN
6053,6053.0,3878.json,False,Says Panasonic stayed in New Jersey because of the Business Retention and Relocation Assistance Grant BRRAG program.,NaN
6054,6054.0,5790.json,True,"At the same time gas prices have increased, the share of the oil market controlled by speculators has more than doubled over the past 10 years.",NaN
6055,6055.0,3335.json,True,"Most federal employees do not have collective bargaining for benefits, nor for pay.",NaN
6056,6056.0,12676.json,True,AfricanAmericans dont use drugs at a higher level than whites but wind up going to prison six times more.,NaN
6057,6057.0,2902.json,True,On offshore oil drilling.,NaN
6058,6058.0,1974.json,False,"When Obama went to Pakistan in 1981, he could not have been traveling as a U.S. citizen.",NaN
6059,6059.0,6188.json,True,"No one in Rhode Island  not just children, no one in Rhode Island  should eat more than one serving of freshwater fish caught in our state each month.",NaN
6060,6060.0,2776.json,True,The interest on the debt now is going to approach in the next couple of years ... what we spend in the national defense budget.,NaN
6061,6061.0,7794.json,True,Says President Barack Obamas proposed budget includes two new tax increases that would collect about 14 billion.,NaN
6062,6062.0,8940.json,True,"The prosecution of state Sen. Don Balfour cost less than 100, excluding prosecutors salaries.",NaN
6063,6063.0,6512.json,True,Says U.S. Senate rival Tammy Baldwin wants a completely governmentcontrolled health care system that goes far beyond Obamacare and is a Medicare system for all.,NaN
6064,6064.0,12352.json,False,"You have to be a citizen to vote, but with sameday voter registration, you have places where people just walk in and vote.",NaN
6065,6065.0,3900.json,True,Rhode Island continues to have the highest rates of substance abuse in the country.,NaN
6066,6066.0,13472.json,True,"Texas AM University  Commerce offers counseling, safe spaces for students who are afraid of Presidentelect Trump.",NaN
6067,6067.0,7770.json,True,"Wars in Afghanistan and Iraq have cost every U.S. family 45,000.",NaN
6068,6068.0,2651.json,True,"Jerry Brown gave California state employees collective bargaining powers and now, state employees can retire at 55 with much of their salary for life.",NaN
6069,6069.0,8368.json,False,Obama has jumped the shark and ordered the ocean closed!,NaN
6070,6070.0,12135.json,False,An image in a ChrisAbele TV ad depicts wealthy citizens who would benefit from a lake created by the controversial Estabrook Dam.,NaN
6071,6071.0,13263.json,True,Says Donald Trumps plan to repeal the estate tax would mean the Walmart Walton family would get a 53 billion tax break.,NaN
6072,6072.0,9360.json,False,"In 2007, Ed Gillespie was paid 300,000 to be the frontman for a coalition that made the individual mandate the centerpiece of its health reform plan.",NaN
6073,6073.0,11714.json,True,Only nine coalition nations with the U.S. are truly actively involved in fighting the Islamic State.,NaN
6074,6074.0,12622.json,False,"Says Hillary Clinton presided over 6 billion lost at the State Department, sold uranium to the Russians through her faux charity, illegally deleted public records, and murdered an ambassador.",NaN
6075,6075.0,5271.json,False,"Studies show that if we opened one reserve in Alaska now, in five years, gas prices could be at 2 a gallon.",NaN
6076,6076.0,10514.json,True,Oil companies can obtain an acre of public land for less than the price of a Big Mac.,NaN
6077,6077.0,539.json,True,"When he was asked a few years ago whether he could see himself lifting the cap on the payroll tax, McCain said, I could. But today hes attacking me for holding the very same position.",NaN
6078,6078.0,3675.json,False,"Says that while his plan would narrow the time for early voting, it still will be one of the most aggressive early voting time frames in America.",NaN
6079,6079.0,12897.json,False,The director of the FBI said that we cannot properly vet people coming from the Middle East.,NaN
6080,6080.0,12907.json,True,"Says his fatherinlaw, former Gov. Linwood Holton, integrated Virginia public schools.",NaN
6081,6081.0,6764.json,False,Says Barack Obama has added 16 trillion to the national debt.,NaN
6082,6082.0,11627.json,True,"Instead of fighting ISIS, the Saudis have focused more on a campaign to oust Iranbacked Houthi rebels in Yemen.",NaN
6083,6083.0,12706.json,False,Hillary Clinton is for open borders.,NaN
6084,6084.0,10960.json,False,"Says the California flag was supposed to be apear, not a bear.",NaN
6085,6085.0,8482.json,False,Texas Governor Rick Perrys voter ID law is a blatant effort to defeat Wendy Davis by disenfranchising tens of thousands of women voters.,NaN
6086,6086.0,5783.json,True,"The number of new businesses started per year has dropped by 100,000 during this presidents term.",NaN
6087,6087.0,9155.json,True,More than 3 million young adults ... have gained insurance under the Affordable Care Act by staying on their familys plan.,NaN
6088,6088.0,6071.json,True,"As governor of Massachusetts, Romney reduced unemployment to just 4.7 percent.",NaN
6089,6089.0,5853.json,False,Says Rep. Paul Ryans budget proposal would effectively double the interest paid out on existing and future student loans.,NaN
6090,6090.0,3464.json,False,On the president unilaterally authorizing a military attack that does not involve stopping an actual or imminent threat to the nation.,NaN
6091,6091.0,8789.json,False,"In some of the states in the U.S., homosexuality remains a felony.",NaN
6092,6092.0,6791.json,True,"Theres at least 7,500 addicted gamblers in Rhode Island, at least, it could be as high as 22,000.",NaN
6093,6093.0,5972.json,False,Says U.S. Rep. Stephen Fincher breaks earmark pledge.,NaN
6094,6094.0,10005.json,True,"Says female genital mutilation is a central African problem, not an Islamic problem, as Bill Maher suggested.",NaN
6095,6095.0,5586.json,True,"Because of the new health care law, Americans no longer will see their coverage dropped or capped when illness strikes.",NaN
6096,6096.0,3965.json,False,Says tax revenue was lower than expected in May and thats basically a clear indication the governors counselors are probably right  that we are still not out of the woods yet.,NaN
6097,6097.0,4673.json,False,"Congressional Republicans have introduced dozens of bills on social issues and other topics, but zero on job creation.",NaN
6098,6098.0,4703.json,True,1.53 million jobs are at risk from potential defense cuts.,NaN
6099,6099.0,12992.json,True,"The Clinton Foundation took steps that went above and beyond all legal requirements and, indeed, all standard requirements followed by every other charitable organization.",NaN
6100,6100.0,12905.json,True,Says Hillary Clinton once wanted a wall on the Mexican border.,NaN
6101,6101.0,1334.json,True,Obama closed offshore tax safe havens.,NaN
6102,6102.0,1221.json,False,Health care mandate will require imprisonment and fines for Americans who cant afford to purchase insurance or pay hefty government penalties.,NaN
6103,6103.0,8775.json,True,"On foreign policy, Joe Biden was against aid for Vietnam, said the fall of the Shah was a step forward for human rights in Iran, opposed Reagans defense buildup and voted against the first Gulf War.",NaN
6104,6104.0,11520.json,False,Says his tax plan wouldnt leave the federal government with a 1.1 trillion hole.,NaN
6105,6105.0,9725.json,False,"The presidents come out with rules that say, No new coalfired power plants.",NaN
6106,6106.0,6201.json,False,"If the U.S. didnt borrow 1.2 trillion every year to fund government operations, that money would be available for entrepreneurs and business people to put to work creating jobs and building and expanding their businesses.",NaN
6107,6107.0,7716.json,True,"Longterm federal investment in U.S. airports is urgent because there was a recent survey of the top airports in the world, and there was not a single U.S. airport that came in the top 25.",NaN
6108,6108.0,420.json,False,I actually started criticizing the war in Iraq before Obama did.,NaN
6109,6109.0,4361.json,True,The health insurance plan that members of Congress have is no different than any other federal employees in the United States government.,NaN
6110,6110.0,8048.json,True,"Since I was elected, crime rates have been at their lowest in over a decade.",NaN
6111,6111.0,7854.json,False,U.S. Rep. John Barrows plan puts the IRS in charge of your health care.,NaN
6112,6112.0,123.json,False,"In 2006, Arizona had four ballot issues that were very tough on illegal immigration... Fortyseven percent of the Hispanics in Arizona voted for them.",NaN
6113,6113.0,3592.json,True,"For every coyote they kill, the population will replace and usually multiply.",NaN
6114,6114.0,11379.json,True,"Number of Americans killed by terrorism in the last decade 24. Number of Americans killed by guns in the last decade 280,024.",NaN
6115,6115.0,7892.json,True,Its expressly prohibited by law that you can read and wholly surveil domestic email traffic in the United States.,NaN
6116,6116.0,707.json,False,The Books Sarah Palin tried to have banned.,NaN
6117,6117.0,5374.json,True,Says unemployment would be at 10 percent if people who have quit looking for work were included in federal labor force calculations.,NaN
6118,6118.0,13259.json,True,Says Colorado congressional candidate Morgan Carroll voted to allow welfare recipients to use your tax dollars at ATMs at strip clubs and pot dispensaries.,NaN
