,Unnamed: 0,id,label,text,triple
7050,7050.0,61.json,True,"When NAFTA was passed, there was an acceleration of immigration from Mexico because people were in search of jobs.",NaN
7051,7051.0,11416.json,True,Sen. Sanders did vote five times against the Brady bill.,NaN
7052,7052.0,1117.json,True,"Under President George W. Bush, the U.S. spent 1.3 trillion on tax cuts for the wealthy and trillions each on a war and on Medicare drug benefits.",NaN
7053,7053.0,11429.json,False,"Says Bernie Sanders once said, Instead of removing the conditions that make people depressed, modern society gives them antidepressant drugs.",NaN
7054,7054.0,11822.json,True,I have never supported cap and trade.,NaN
7055,7055.0,5754.json,False,"The nonpartisan Congressional Budget Office concluded ObamaCare will cost the U.S. more than 800,000 jobs.",NaN
7056,7056.0,471.json,False,There are prototype cars that get between 100 and 150 miles per gallon and we could have those cars in your garages in a couple of years.,NaN
7057,7057.0,12502.json,True,"30,000 Arizonans may have no choice on Affordable Care Act coverage.",NaN
7058,7058.0,3424.json,True,"There are corporations in this nation, some of the biggest corporations in this nation, who do not pay taxes.",NaN
7059,7059.0,1331.json,True,The United States has a supply of more than 100 years of natural gas.,NaN
7060,7060.0,9283.json,True,Says Virginia House Republicans are sacrificing 5 million a day in U.S. funds by refusing to expand Medicaid.,NaN
7061,7061.0,3006.json,False,I represent the fourthpoorest congressional district in the nation.,NaN
7062,7062.0,8727.json,True,The federal health care law tells the American people precisely what type of coverage they have to have.,NaN
7063,7063.0,7774.json,True,Ohios lost more jobs in March than any other state in the nation.,NaN
7064,7064.0,13245.json,False,Says Patrick Murphy wrongly conveyed Rubios stance on abortion for women infected by Zika.,NaN
7065,7065.0,11551.json,True,Income inequality seems to be worst in cities run by Democrats.,NaN
7066,7066.0,1360.json,False,A recent drop in the unemployment rate is questionable because it was calculated over two days of the Thanksgiving week.,NaN
7067,7067.0,10030.json,True,The states that have raised the minimum wage this year have had faster job growth than the states that havent raised the minimum wage.,NaN
7068,7068.0,6603.json,True,"In his first TV interview as president, Obama said we should talk to Iran.",NaN
7069,7069.0,1341.json,False,I have never voted for a tax increase.,NaN
7070,7070.0,9163.json,False,"Says U.S. Reps. Phil Gingrey and Jack Kingston have even changed votes to what I voted, multiple times.",NaN
7071,7071.0,405.json,False,"Hillary Clinton and Barack Obama want to raise taxes on dividends, a move that would crash the stock market.",NaN
7072,7072.0,6193.json,False,"Environmentalists said Were only going to stop coal mining above 2,000 feet. ... Well guess where all the coal in the state of Tennessee is? Above 2,000 feet.",NaN
7073,7073.0,4726.json,False,Proof of citizenship isnt necessary before you register to vote in Florida.,NaN
7074,7074.0,3665.json,True,Says Florida is one of a few or perhaps the only state that has a statewide review of local land use and zoning decisions.,NaN
7075,7075.0,7089.json,False,"Says that with President Obamas reelection, state and federal income tax rates for some taxpayers will rise to roughly 65 percent.",NaN
7076,7076.0,168.json,True,My husband has not withheld a single document.,NaN
7077,7077.0,5714.json,False,Why was there no news coverage of this raid on the Arizona border? Seizure was just five days ago. Right on the Arizona border!,NaN
7078,7078.0,6107.json,True,Say Portland Public Schools central administration makes up less than 4 percent of the staff.,NaN
7079,7079.0,4870.json,False,Says Mitt Romney has changed his position on supporting the TARP program.,NaN
7080,7080.0,10604.json,True,"If President Barack Obama strikes a nuclear deal with Iran, the next president could revoke such an executive agreement with the stroke of a pen and future Congresses could modify the terms of the agreement at any time.",NaN
7081,7081.0,4877.json,False,The St. Norbert CollegeWisconsin Public Radio poll has been wrong in almost every election.,NaN
7082,7082.0,6734.json,False,"President Obama has no plan to reduce the deficit, let alone pay down the debt.",NaN
7083,7083.0,13317.json,True,Says electric utilities are trying to fool you into amending your state Constitution in a way that gives them the authority to shut down net metering.,NaN
7084,7084.0,11440.json,False,Wisconsins Government Accountability Board wanted to consider Mickey Mouse and Adolf Hitler as valid signatures on recall petitions.,NaN
7085,7085.0,10669.json,True,Theres just one piece of legislation that is now law with Sen. Ted Cruzsname on it.,NaN
7086,7086.0,5697.json,True,An effort to repeal votingreform legislation would be the first time in Ohio history where a bill has been passed to stop a referendum.,NaN
7087,7087.0,484.json,False,They Clinton and Obama have never to my knowledge been involved in legislation nor hearings nor engagement on this issue climate change.,NaN
7088,7088.0,8633.json,True,FACT Repealing Obamacare would be easier than repealing Prohibition.,NaN
7089,7089.0,6598.json,True,The majority of Americans now doubt that our children will have a better future.,NaN
7090,7090.0,672.json,False,McCain said no to higher fuelefficiency standards for cars.,NaN
7091,7091.0,3259.json,True,The Constitution doesnt allow the governor to notspend appropriations funds.,NaN
7092,7092.0,12962.json,False,One third of all federal prisoners today are illegal immigrants.,NaN
7093,7093.0,7986.json,True,"Says under the Senate immigration bill, newly legalized immigrants will pay every tax possible, but you dont get a single benefit for 10 years.",NaN
7094,7094.0,9826.json,False,"Each Georgia taxpayer would have to send 5,000 to the treasury to cover the states debt.",NaN
7095,7095.0,4476.json,False,"Says Mitt Romney wrote that if Social Security was done in the private sector, it would be called criminal.",NaN
7096,7096.0,3056.json,True,A record number of Hispanics were elected to the U.S House of Representatives...,NaN
7097,7097.0,8113.json,True,Theyve seen employersupported coverage increase in Massachusetts after this law Romneycare was implemented.,NaN
7098,7098.0,12490.json,True,Says its not true that Florida black bears are an apex predator.,NaN
7099,7099.0,4731.json,False,A state bill would end a longstanding requirement that local governments repair highways and sidewalks  and block injured citizens from suing over neglected maintenance.,NaN
7100,7100.0,9865.json,True,Miller Brewing is not a U.S. company any more. Neither is AnheuserBusch.,NaN
7101,7101.0,11417.json,True,Says as secretary of state she was reserving judgment about the TransPacific Partnership and hoped it would be the gold standard.,NaN
7102,7102.0,1261.json,False,An Iowa policy provides for a state round up of Iowa citizens who might be exposed to the swine flu virus.,NaN
7103,7103.0,4859.json,True,Says U.S. Sen. Bill Nelson voted with the Democrats in Congress nearly 95 percent of the time.,NaN
7104,7104.0,7945.json,True,Says proposed teacher contract would layer on more restrictive rules.,NaN
7105,7105.0,10643.json,True,"Weve got 40 years of study now that show that, with a good preschool start, youre less likely to be on public dole, youre less likely to be in prison.",NaN
7106,7106.0,5674.json,True,"Richard Hayne, president and CEO of Urban Outfitters is a supporter of Rick Santorum and donated over 13,000 to him.",NaN
7107,7107.0,5767.json,True,Congress as a whole is less popular than its been since polling was invented.,NaN
7108,7108.0,12477.json,True,Says Donald Trump says he has foreign policy experience because he ran the Miss Universe pageant in Russia.,NaN
7109,7109.0,10149.json,True,Says Scott Walker gave 6 million in tax breaks to a corporation and told them that they can keep that money even if they lay off half their workforce.,NaN
7110,7110.0,1874.json,True,Halliburton defrauded American taxpayers of hundreds of millions of dollars in Iraq.,NaN
7111,7111.0,7697.json,False,Abortionists have reduced our black population by more than 25 percent since 1973.,NaN
7112,7112.0,4358.json,True,"Weve had 11,000 attempts to amend the Constitution since 1789.",NaN
7113,7113.0,10868.json,False,Democrat Russ Feingold announced his Wisconsin Senate run today fromCalifornia.,NaN
7114,7114.0,11295.json,False,Inspections of abortion centers around Virginia have found multiple violations of parental consent laws but Gov. Terry McAuliffe and his administration have done nothing.,NaN
7115,7115.0,5692.json,False,Says gubernatorial recall candidate Tom Barrett supported passage of Gov. Scott Walkers bill stripping collective bargaining of state employees.,NaN
7116,7116.0,3262.json,True,Says some in Congress are trying to create a separate government for those with a drop of Native Hawaiian blood.,NaN
7117,7117.0,8265.json,False,Says he opposed the presidents decision to go into Iraq in 2003.,NaN
7118,7118.0,1604.json,False,The Federal Reserve system has presided over about a 95... percent decline in the U.S. dollar.,NaN
7119,7119.0,1757.json,True,"Numbers on illegal immigrants are down in terms of apprehensions, which indicates fewer illegal crossings, but also up in terms of actual enforcement actions.",NaN
7120,7120.0,8232.json,False,Says Gov. Scott Walker hasnt done a public event this entire year.,NaN
7121,7121.0,530.json,True,Obama wants a windfall profits tax on oil to go along with the new taxes he also plans for coal and natural gas.,NaN
7122,7122.0,1764.json,True,"If you will go look up the definition of act of God, weve used it in legal terms for a long time in this state.",NaN
7123,7123.0,10520.json,True,Monarch butterflies are becoming extinct because of increased use of crops genetically modified to withstand pesticides.,NaN
7124,7124.0,5807.json,False,President Obama gave Egypts Muslim Brotherhood one and a half billion dollars.,NaN
7125,7125.0,12102.json,False,Says Donald Trump promised to take care of everybody through governmentrun healthcare and the governments going to pay for it.,NaN
7126,7126.0,12266.json,False,"Says professional football coach Rex Ryan won championships in New York.The AFC, I think, twice.",NaN
7127,7127.0,12747.json,True,Says Hillary Clinton wants sanctuary cities.,NaN
7128,7128.0,1931.json,True,"Health reform eliminates copays, deductibles, and other costs for preventative care and provides for free annual wellness checkups starting next year.",NaN
7129,7129.0,7317.json,True,"Says according to the FBI, more people are killed each year with hammers and clubs than rifles.",NaN
7130,7130.0,8524.json,True,"Says Rick Scott cut education by 1.3 billion in his first year, then in his second year he decreases funding by 300 million to our state universities.",NaN
7131,7131.0,12396.json,True,"Trade deals are negotiated in secret and, unlike corporate interests,politicians never invite the leaders of the AFLCIO or steelworkers or the mine workers to come in and sit down in these meetings.",NaN
7132,7132.0,11696.json,True,"Regarding the USA Freedom Act, There is nothing we are allowed to do under this bill that we could not do before.",NaN
7133,7133.0,2351.json,False,"Our law enforcement agencies have found bodies in the desert, either buried or just lying out there, that have been beheaded.",NaN
7134,7134.0,2483.json,False,Says he took down the mob in Northeast Ohio,NaN
7135,7135.0,9667.json,False,The state of New York is the worst in the nation in economic recovery.,NaN
7136,7136.0,9764.json,True,Says he invested over 100 million in worker training.,NaN
7137,7137.0,9688.json,False,"Says Rep. Bruce Braley, DIowa, skipped an important VA reform hearing to attend three fundraisers.",NaN
7138,7138.0,11457.json,False,"Says CIA Director George Tenet told the Bush administration that the Sept. 11, 2001, terrorist attack was coming. So they did have advanced notice.",NaN
7139,7139.0,12895.json,False,Says Hillary Clinton doesnt believe in your right to keep a gun at home for selfdefense.,NaN
7140,7140.0,7507.json,True,"Says Jennifer Horn, chairwoman of the N.H. Republican Party, owes 92,000 in back taxes.",NaN
7141,7141.0,8900.json,True,"The median net worth of American households hasnt changed much over the past decades, its about 20,000 ... but Congress average median net worth has ballooned, more than doubled.",NaN
7142,7142.0,11903.json,False,Scott Fisher tried to expand Obamacare in Texas and even voted for an official resolution to force 1 million Texans into Obamacare.,NaN
7143,7143.0,11250.json,True,Saudi Arabia has the thirdlargest military budget in the entire world.,NaN
7144,7144.0,4767.json,True,"In April 2009 the Democrats were in control, and the congressional approval rating was 40 percent.",NaN
7145,7145.0,2909.json,True,Barack Obamas health care bill is nothing new. Mitt Romney signed one just like it four years before.,NaN
7146,7146.0,13399.json,False,Says that hes responsible for Austinincluding Anderson Mill Road in the citys proposed transportation bond package.,NaN
7147,7147.0,4889.json,False,Says the Department of Defense changed its definitions of alQaeda and the Taliban making it so almost anybody can be loosely associated with the groups.,NaN
7148,7148.0,6443.json,True,Art Robinson says Social Security should be ended through attrition.,NaN
7149,7149.0,7351.json,True,Tide gauges measuring sea level in Rhode Island since 1930 have risen maybe about 10 inches since that time.,NaN
7150,7150.0,11488.json,False,"Unlike Benghazi, there were no investigations of the 1983 Beirut barracks bombing, none about key aspects of the 911 attacks and the Iraq War, and none about embassy attacks under George W. Bush.",NaN
7151,7151.0,4427.json,True,360 million of our tax dollars went straight to ... the Taliban.,NaN
7152,7152.0,1463.json,False,"On whether he supports Dont Ask, Dont Tell.",NaN
7153,7153.0,8574.json,False,A Census Bureau worker says he was told to skew information to bring the unemployment rate down as we headed into an election season.,NaN
7154,7154.0,11534.json,True,"Says that in polls about 2016 candidate leadership skills, he comes out two and three and four times higher than anybody else.",NaN
7155,7155.0,10490.json,True,The 2012 National Survey on Drug Use and Health found that up to half of daily marijuana smokers become addicted  an estimated 2.7 million people in the U.S.,NaN
7156,7156.0,6062.json,True,"When I started in Ohio it was terrible. Now, were getting bipartisan support for our bills. And thats called leadership.",NaN
7157,7157.0,3896.json,False,Says Gov. Chris Christies decision to close the Elizabeth MVC saved no money.,NaN
7158,7158.0,7074.json,True,Sixty percent of New Jersey doctors do not accept Medicaid patients.,NaN
7159,7159.0,2074.json,True,"As a Congressman, J.D. Hayworth was an avid earmarker who supported such pork as 220,000 to renovate a Maine Blueberry farm and 5.8 million for a Vermont snowmobile trail.",NaN
7160,7160.0,6526.json,True,Says cities save an estimated 38 in dental costs for every 1 invested in fluoridation.,NaN
7161,7161.0,23.json,True,"At least Obama didnt marry his cousin, as Giuliani did.",NaN
7162,7162.0,3644.json,True,"Gov. Rick Perry helped balance his budget with about 6 billion worth of federal help, which he happily took, and then started blaming the members of Congress who had offered that help.",NaN
7163,7163.0,3310.json,False,President Obama came to Ohio 12 times to try to defeat me and guess what? He didnt win.,NaN
7164,7164.0,6307.json,True,On suspending system development charges for two years.,NaN
7165,7165.0,9166.json,True,"Of all the jobs President Obama claims to have created since he started, only 38.5 percent are women. So 61.5 percent have gone to men.",NaN
7166,7166.0,5492.json,False,If you look up the dictionary definition of happiness at the time of our founders happiness was not doing what you want to do but doing what you ought to do.,NaN
7167,7167.0,10216.json,True,"Amendment 2 on medical marijuana won a higher percentage of the vote than the last six Florida governors, including Jeb Bushs 2002 landslide.",NaN
7168,7168.0,4570.json,True,Health care is the greatest contribution to spending increases in the state budget.,NaN
7169,7169.0,5743.json,True,"The Buffett rule raises virtually no money, maybe a day and a half of our borrowing per year.",NaN
7170,7170.0,2340.json,True,Georgias U.S. senators voted for legislation that would gut clean air protections and increase oil dependence.,NaN
7171,7171.0,4647.json,True,Romneycare was model for Obamacare.,NaN
7172,7172.0,6711.json,True,"The Providence Economic Development Partnership . . .which you Cicilline chaired, loaned 103,000 in taxpayer funds to one of your campaign workers. The worker never paid back the loan.",NaN
7173,7173.0,8410.json,False,No doctors who went to an American medical school will be accepting Obamacare.,NaN
7174,7174.0,4121.json,False,The 290 million structural surplus in the 201113 Wisconsin budget is not real because it is based on the assumption that Congress will reinstate the estate tax.,NaN
7175,7175.0,9207.json,False,Dan Patrick changed his name from Danny Goeb to hide from his debts.,NaN
7176,7176.0,3545.json,True,"Were paying outofstate residential facilities hundreds of thousands of dollars, if not more, to house children in state custody",NaN
7177,7177.0,9730.json,False,The perpupil cost in the Blackstone Valley Prep Mayoral Academy far outweighs the perpupil cost in Cumberland public schools.,NaN
7178,7178.0,12354.json,True,"Before April 22, we have restored the rights of more than 18,000 individuals, which is more than the past seven governors combined in their fouryear terms.",NaN
7179,7179.0,1016.json,False,The federal Hate Crimes Prevention Act bill would create special protection for pedophiles.,NaN
7180,7180.0,3521.json,False,Says Wisconsin Supreme Court candidate JoAnne Kloppenburg put an 80yearold farmer in jail for refusing to plant native vegetation on his farm.,NaN
7181,7181.0,2241.json,True,"In 1935, more than 50 of the elderly population lived in poverty. Today that poverty rate stands officially at 9.4.",NaN
7182,7182.0,12111.json,True,Superdelegates have never been a determining factor in who our nominee is since theyve been in place since 1984.,NaN
7183,7183.0,1908.json,True,Says the Republican state convention is actually larger than the Republican National Convention.,NaN
7184,7184.0,8055.json,False,"In his book, Ken Cuccinelli questions whether Medicare and Social Security should exist.",NaN
7185,7185.0,4311.json,True,There are 500 million Internet users and 80 million bloggers who are driving discussions in China. So youve got a lot of people voicing frustration and discontent.,NaN
7186,7186.0,4664.json,True,My son had to resign his job because of federal regulations that Washington has put on us.,NaN
7187,7187.0,1337.json,True,The Senate health care bill would leave 24 million people without insurance coverage.,NaN
7188,7188.0,7997.json,False,More Americans receive food aid than work in the private sector.,NaN
7189,7189.0,12699.json,True,"Illegal tobacco sales, price driven too high, has been connected to at least several cases of funding terrorism against us in multiyear investigations over the last decade and a half.",NaN
7190,7190.0,3316.json,False,Some of our states educational administrators joined the feds in seeking to mandate Arabic classes for Texas children.,NaN
7191,7191.0,1392.json,False,Says Land Commissioner Jerry Patterson threatened to shoot him.,NaN
7192,7192.0,10985.json,True,"Between 1980 and 2010, water usage in Georgia dropped even as the states population grew.",NaN
7193,7193.0,8788.json,True,"The General Assembly has no explicit constitutional authority to impose income, sales, estate and the myriad of other taxes upon us.",NaN
7194,7194.0,1041.json,False,"Inside the stimulus package is antiChristian legislation that will stop churches from using public schools for meeting on Sundays, as well as Boy Scouts and student Bible study groups.",NaN
7195,7195.0,7767.json,True,A Wisconsin bill to limit use of food stamps for junk food would also prevent  or limit  the extent to which food stamps could be used for organic foods.,NaN
7196,7196.0,12459.json,True,Were losing thousands of veterans waiting on line because they cant get speedy health care from the Veterans Administration.,NaN
7197,7197.0,3562.json,False,The newly proposed House Republican budget abolishes Medicare within 10 years.,NaN
7198,7198.0,3932.json,True,Says George LeMieux falsely attacked Marco Rubio.,NaN
7199,7199.0,12775.json,True,There are fewer people crossing the southwest border than in the last 30 years.,NaN
7200,7200.0,9980.json,False,Health insurance costs for Floridians are up 30 percent or more.,NaN
7201,7201.0,8974.json,False,Says Lamar Smith sponsored the bill that funded Obamacare.,NaN
7202,7202.0,8382.json,True,On responding to chemical weapon use in Syria,NaN
7203,7203.0,12559.json,True,The LGBT community is more often the victims of hate crimes than any other recognized group.,NaN
7204,7204.0,520.json,True,Obama has maintained a friendship with a now convicted felon.,NaN
7205,7205.0,6280.json,False,Says Mitt Romneys carried interest income was a tax trick.,NaN
7206,7206.0,5307.json,False,"Since ObamaCare and the stimulus passed, the unemployment rate in the U.S. has increased.",NaN
7207,7207.0,5474.json,True,"In 2011, there were more than 28,000 new Tennessee jobs created and over 4 billion in capital investment. Our Jobs4TN plan is working.",NaN
7208,7208.0,3647.json,True,Each day our nation pays communist China 73.9 million in interest on our debt.,NaN
7209,7209.0,2965.json,False,Sen. Jim Webb persists on negating Sen. Mark Warners votes,NaN
7210,7210.0,2529.json,True,Rhode Island has a very generous unemployment compensation rate compared to most other states.,NaN
7211,7211.0,11066.json,True,"Says she called for addressing risks of derivatives, cracking down on subprime mortgages and improving financial oversight early on in the financial crisis.",NaN
7212,7212.0,8365.json,True,There is a constitutional issue that affects the paychecks of members of Congress during a shutdown.,NaN
7213,7213.0,3133.json,True,No one in the private sector gets unlimited accruals of vacation and sick leave.,NaN
7214,7214.0,586.json,True,Says Obama has flipflopped on public campaign financing.,NaN
7215,7215.0,8619.json,False,Back door gun control is in full effect in the United States due to Obamas Environmental Protection Agency.,NaN
7216,7216.0,9814.json,True,"The Obama administration originally wanted 10,000 troops to remain in Iraq  not combat troops, but military advisers, special operations forces, to watch the counterterrorism effort.",NaN
7217,7217.0,13235.json,False,ICE just endorsed me.,NaN
7218,7218.0,4236.json,False,Tax increases under Michigan Gov. Jennifer Granholm led to state unemployment going from 6.8 percent to 15.3 percent.,NaN
7219,7219.0,7833.json,False,Ronald Reagans signature on the 1986 amnesty act gave Barack Obama about 15 million additional Hispanic votes in 2012.,NaN
7220,7220.0,12143.json,False,Nevada lawmakers permanently cut taxes for over 95 percent of Nevadas businesses.,NaN
7221,7221.0,2383.json,False,Says Texas U.S. Rep. Pete Sessions said the GOPs goal is to go back to the same exact policies that were in place before this president took office... policies that crashed the economy.,NaN
7222,7222.0,12034.json,False,Says Donald Trump said the government is going to pay for everybody to have health care.,NaN
7223,7223.0,7240.json,False,Says 11 states have more people on welfare than employed.,NaN
7224,7224.0,9625.json,False,"Says former Federal Reserve Chairman Alan Greenspan said that if the workers are more insecure, thats very healthy for the society because theyll serve the masters gladly and passively.",NaN
7225,7225.0,9988.json,True,On the economic stimulus.,NaN
7226,7226.0,12727.json,False,Neighborhoods have become more violentunder President Barack Obamas watch.,NaN
7227,7227.0,9868.json,False,Obama admin gutted ProjChildSafe budget to provide trigger locks and safety kits.,NaN
7228,7228.0,209.json,True,Barack Obamas health care plan would leave 15million Americans out.,NaN
7229,7229.0,9099.json,True,Our high school graduation rate is the highest on record.,NaN
7230,7230.0,4384.json,False,"Say Ohio Reps. Marcia Fudge, Marcy Kaptur and Dennis Kucinich are socialists who are openly serving in the U.S. Congress.",NaN
7231,7231.0,2080.json,True,Were not engaged in nationbuilding in Afghanistan.,NaN
7232,7232.0,3104.json,False,"Says the Defense Department shrinkwrapped 10.8 billion in American money, loaded it on 175 pallets and put it on a transport plane to Iraq where they passed out 100 bills and no one has any receipts.",NaN
7233,7233.0,2667.json,False,Says he stood up to his own party by voting against the budget to stop runaway government spending.,NaN
7234,7234.0,9202.json,False,Democrats very much are in the pocket of the NRA.,NaN
7235,7235.0,8599.json,True,"Floridas proposed amendment for medical marijuana would allow people who alleged minor ailments such as muscle spasms, neck pain, back pain and even menstrual cramps to qualify for governmentsanctioned potsmoking.",NaN
7236,7236.0,10101.json,False,Some doctors say Ebola can be transmitted through the air by a sneeze or some cough.,NaN
7237,7237.0,8621.json,True,"We, the bishops of the United States  can you believe it  in 1919 came out for more affordable, more comprehensive, more universal health care.",NaN
7238,7238.0,5932.json,False,On support for Ronald Reagans policies,NaN
