,index,id,label,text,triple
93,642,984.json,False,President Obama has never received a paycheck from a profitmaking business in his entire life.,"[['Barack Obama', 'people/person/employment_history./business/employment_tenure/title', 'President']]"
94,648,1272.json,False,"If President Obama signs the Copenhagen climate change treaty, he will sign your freedom, your democracy, and your prosperity away forever and neither you nor any subsequent government you may elect would have any power whatsoever to take it back again.","[['Barack Obama', 'people/person/employment_history./business/employment_tenure/title', 'President']]"
95,650,1356.json,False,Labor union president Andy Stern is the most frequent visitor at the White House.,"[['Andy Stern', 'people/person/employment_history./business/employment_tenure/title', 'President'], ['Andy Stern', 'organization/role/leaders./organization/leadership/person', 'Labour']]"
96,661,11489.json,False,How is a misogynist bigot of epic proportions like U.S. Rep. Steven Smith allowed to serve?,"[['Steve Smith (cricketer)', 'people/person/employment_history./business/employment_tenure/title', 'REP']]"
97,667,3279.json,True,"The firefighters, the policemen and others who supported Wisconsin Gov. Scott Walker in his election bid ... dont have to worry about their collective bargaining rights.","[['Scott Walker (sanger)', 'people/person/employment_history./business/employment_tenure/title', '.gov']]"
98,683,1793.json,False,"Elena Kagan is a New York City radical, Marxist lawyer through and through.","[['Elena Kagan', 'people/person/employment_history./business/employment_tenure/title', 'York']]"
99,688,5968.json,False,Says large majority of Republicans believe Obama is a Muslim and not U.S.born.,"[['Barack Obama', 'people/person/religion', 'Islam'], ['Birthright citizenship in the United States', 'location/statistical_region/religions./location/religion_percentage/religion', 'Islam']]"
100,695,13362.json,False,"When Trump wanted to turn a taxpayerowned building into an 800 anight hotel, Congressman Jeff Denham, RCA helped broker the deal and bragged about it.","[['Jeff Denham', 'people/person/employment_history./business/employment_tenure/title', 'Member of Congress'], ['Donald Trump', 'people/person/employment_history./business/employment_tenure/title', 'Jeff Denham']]"
101,714,5614.json,False,Says former U.S. Rep. Carol SheaPorter refused to host town hall meetings during her time in Congress.,"[['Carol Shea-Porter', 'people/person/employment_history./business/employment_tenure/title', 'REP']]"
102,716,1043.json,False,On calling Supreme Court nominee Sonia Sotomayor a racist.,"[['Sonia Sotomayor', 'organization/role/leaders./organization/leadership/person', 'Supreme Court of the United States']]"
103,720,1609.json,False,Marco Rubio is a Miami lobbyist.,"[['Marco Rubio', 'people/person/employment_history./business/employment_tenure/title', 'Lobbyist']]"
104,742,1848.json,True,"When Roy Barnes was governor, Georgia created 235,000 jobs.","[['Roy Barnes', 'people/person/employment_history./business/employment_tenure/title', 'Governor']]"
105,763,9224.json,False,Says North Carolina Republican Senate candidate Thom Tillis called Obamacare a great idea.,"[['Thom Tillis', 'people/person/employment_history./business/employment_tenure/title', 'Candidate'], ['Thom Tillis', 'organization/role/leaders./organization/leadership/person', 'Thom Tillis']]"
106,766,6036.json,True,"Under Gov. Mitt Romney, Massachusetts ranked 47th in job creation.","[['Mitt Romney', 'people/person/employment_history./business/employment_tenure/title', '.gov'], ['Massachusetts', 'people/person/employment_history./business/employment_tenure/title', 'Mitt Romney'], ['Massachusetts', 'people/person/employment_history./business/employment_tenure/title', 'Mitt Romney']]"
107,770,2620.json,False,"Said U.S. Rep. Jim Marshall, DMacon, sent nearly 2 billion overseas to build wind turbines and create jobs, mostly in China","[['Jim Marshall (businessman)', 'people/person/employment_history./business/employment_tenure/title', 'REP']]"
108,796,3834.json,False,"The Medicare proposal by Rep. Paul Ryan, RWis., would allow insurance companies to deny you coverage and drop you for preexisting conditions.","[['Paul Ryan', 'people/person/employment_history./business/employment_tenure/title', 'REP']]"
109,803,6946.json,False,Women who have miscarriages could be investigated by police under legislation supported by Republican state Senate candidate Rick Gudex.,"[['Rick Gudex', 'people/person/employment_history./business/employment_tenure/title', 'Candidate'], ['Rick Gudex', 'organization/role/leaders./organization/leadership/person', 'USAs senat']]"
110,806,1372.json,False,President Obama doesnt ... want to admit were at war.,"[['Barack Obama', 'people/person/employment_history./business/employment_tenure/title', 'President'], ['Barack Obama', 'people/person/employment_history./business/employment_tenure/title', 'War']]"
111,812,4616.json,False,Says Texas Senate hopeful Donna Campbell doesnt live in the district shes hoping to win in 2012.,"[['Donna Campbell', 'organization/role/leaders./organization/leadership/person', 'Texas Senate']]"
112,815,7110.json,False,"Says Gov. Scott Walker has led people to believe that if Wisconsin doesnt implement a healthcare exchange, Obamacare doesnt happen here.","[['Scott Walker (sanger)', 'people/person/employment_history./business/employment_tenure/title', '.gov']]"
113,846,2650.json,True,Republican candidate for governor Nathan Deal fought to weaken Georgias rape shield law.,"[['Nathan Deal', 'people/person/employment_history./business/employment_tenure/title', 'Governor']]"
114,857,4374.json,False,Says President Barack Obama delivered 2 billion to Brazil to help with offshore drilling projects.,"[['Barack Obama', 'people/person/employment_history./business/employment_tenure/title', 'President']]"
115,862,4897.json,False,Says Wisconsin Gov. Scott Walker is making voting more difficult by closing Department of Motor Vehicles offices where lowincome voters live.,"[['Scott Walker (sanger)', 'people/person/employment_history./business/employment_tenure/title', '.gov']]"
116,870,11543.json,True,When President Obama was running for reelection Senator Sanders was trying to find someone to primary him.,"[['Barack Obama', 'people/person/employment_history./business/employment_tenure/title', 'President'], ['Bernie Sanders', 'people/person/employment_history./business/employment_tenure/title', 'Senator']]"
117,873,6003.json,True,"To help balance the 201113 budget, Gov. Scott Walker used a credit card approach that pushed over 500 million in debt onto our children and our grandchildren costing state taxpayers more than 150 million in interest.","[['Scott Walker (sanger)', 'people/person/employment_history./business/employment_tenure/title', '.gov']]"
118,877,4283.json,False,Says Democratic state Sen. Jim Holperin voted against a property tax freeze in 2009 and then voted for a 1.5 billion property tax hike.,"[['Jim Holperin', 'people/person/employment_history./business/employment_tenure/title', 'State senator']]"
119,885,6258.json,False,"Bill OBriens Tea Party legislature tried to repeal kindergarten and compulsory education, defund Planned Parenthood and eliminate insurance coverage for birth control.","[['Tea Party-bevegelsen', 'organization/role/leaders./organization/leadership/person', ""Bill O'Brien (American football)""]]"
120,895,13383.json,False,Says Hillary Clinton shows up in Broward County and had a private meeting with elections supervisor Brenda Snipes.,"[['Brenda Snipes', 'people/person/employment_history./business/employment_tenure/title', 'Supervisor']]"
121,897,2384.json,True,"Clayton County has employed 1,300 people over the past seven months through the Neighborhood Stabilization Program.","[['County', 'location/hud_county_place/county', 'Clayton']]"
122,899,5701.json,True,"Mayor Tom Barretts policies drove unemployment up 27 percent in Milwaukee, pushing it to one of Americas 10 worst cities for unemployment.","[['Tom Barrett (Wisconsin politician)', 'people/person/employment_history./business/employment_tenure/title', 'Mayor']]"
123,903,4404.json,False,"The Massachusetts health care plan dealt with 8 percent of our population, far less than the 100 percent of American people affected by President Barack Obamas health care law.","[['Barack Obama', 'people/person/employment_history./business/employment_tenure/title', 'President']]"
124,906,1761.json,True,Incoming House Speaker Dean Cannon and incoming Senate President Mike Haridopolos have said they plan to champion efforts next legislative session to allow oil rigs off Floridas coast.,"[['Dean Cannon', 'organization/role/leaders./organization/leadership/person', '117th United States Congress'], ['Mike Haridopolos', 'people/person/employment_history./business/employment_tenure/title', 'President'], ['Mike Haridopolos', 'organization/role/leaders./organization/leadership/person', 'USAs senat']]"
125,919,2004.json,True,"Says state Rep. Jim Keffer, a GOP lieutenant to House Speaker Joe Straus, did mail pieces for Democrat Mark Strama to help him defeat a Republican.","[['Jim Keffer', 'people/person/employment_history./business/employment_tenure/title', 'United States House of Representatives'], ['Jim Keffer', 'people/person/employment_history./business/employment_tenure/title', 'Joe Straus'], ['Joe Straus', 'people/person/employment_history./business/employment_tenure/title', 'Speaker i Representantenes hus i USA']]"
126,921,1039.json,True,"The Department of Justice, under the Obama administration, disagrees with the decision Judge Sotomayor made in the Ricci vs. DeStefano case.","[['Javier Sotomayor', 'people/person/employment_history./business/employment_tenure/title', 'Judge']]"
127,929,1843.json,True,"After the oil spill, Congressman Adam Putnam doubled down saying all energy sources, including oil drilling in the Gulf, should be considered just days after the oil spill started.","[['Adam Putnam', 'people/person/employment_history./business/employment_tenure/title', 'Member of Congress']]"
128,936,4322.json,False,Says Gov. Rick Scott is spending a quarter of a million of our tax dollars to robocall people.,"[['Rick Scott', 'people/person/employment_history./business/employment_tenure/title', '.gov']]"
129,952,5926.json,False,Says Gov. Scott Walker said no to equal pay for equal work for women.,"[['Scott Walker (sanger)', 'people/person/employment_history./business/employment_tenure/title', '.gov']]"
130,965,7622.json,False,Congresswoman Frederica Wilson successfully postpones closure of the North Perry airport tower.,"[['Frederica Wilson', 'people/person/employment_history./business/employment_tenure/title', 'Member of Congress']]"
131,977,11293.json,True,"The top man at Yale Law School came out ... with just a raging report about former HP CEO Carly Fiorina,saying she isone of the worst executives in his memory in history running the company.","[['Carly Fiorina', 'people/person/employment_history./business/employment_tenure/title', 'Chief executive officer']]"
132,984,1634.json,True,"Since that famous day in February where the governor campaigned with Barack Obama on behalf of the stimulus program, 211,000 Floridians have lost their jobs.","[['Governor', 'people/person/employment_history./business/employment_tenure/title', 'Barack Obama']]"
133,1004,4690.json,False,"Former Alaska Governor Sarah Palin was right that President Barack Obamas health care bill created what would, in effect, be death panels.","[['Sarah Palin', 'people/person/employment_history./business/employment_tenure/title', 'Governor'], ['Barack Obama', 'people/person/employment_history./business/employment_tenure/title', 'President']]"
134,1018,9511.json,True,U.S. Senate candidate Michelle Nunn has avoided taking a stand on Obamacare.,"[['Michelle Nunn', 'organization/role/leaders./organization/leadership/person', 'USAs senat'], ['Michelle Nunn', 'people/person/employment_history./business/employment_tenure/title', 'Candidate']]"
135,1029,13140.json,True,Says MarcoRubio voted to slash school funding by billions of dollars and would eliminate the Department of Education.,"[['Marco Rubio', 'organization/role/leaders./organization/leadership/person', '200'], ['Marco Rubio', 'organization/role/leaders./organization/leadership/person', '200']]"
136,1037,11988.json,False,Says Milwaukee County Executive Chris Abele is a billionaire.,"[['Chris Abele', 'people/person/employment_history./business/employment_tenure/title', 'Executive (government)'], ['Chris Abele', 'organization/role/leaders./organization/leadership/person', 'Milwaukee County']]"
137,1045,6322.json,False,"Says U.S. Rep. Sean Duffy is among seven Tea Party freshmen who spent an average of 15,000 on cars for themselves.","[['Sean Duffy', 'people/person/employment_history./business/employment_tenure/title', 'REP']]"
138,1064,6790.json,False,Tea Party Congressman Frank Guinta voted for billions in cuts to veterans programs.,"[['Frank Guinta', 'people/person/employment_history./business/employment_tenure/title', 'Member of Congress']]"
139,1083,1819.json,False,"In three days last week, Gov. Rick Perry flew to five cities at taxpayers expense, holding press conferences, delivering 2,325,000 in checks.","[['Rick Perry', 'people/person/employment_history./business/employment_tenure/title', '.gov']]"
140,1091,5319.json,False,Says President Barack Obama has an Environmental Protection Agency proposal that would raise the price of gasoline by 25 cents a gallon.,"[['Barack Obama', 'people/person/employment_history./business/employment_tenure/title', 'President']]"
141,1097,1863.json,True,"If voters agree in November to approve a onecent sales tax increase, that will give Hillsborough County the highest sales tax of all Florida counties.","[['County', 'location/hud_county_place/county', 'Hillsborough-tragedien']]"
142,1099,12893.json,False,Says President Bill Clinton did not sign NAFTA.,"[['Bill Clinton', 'people/person/employment_history./business/employment_tenure/title', 'President']]"
143,1100,5523.json,True,Says Gov. Scott Walker cut aid to local schools despite campaigning on trying to restore twothirds state funding for education,"[['Scott Walker (sanger)', 'people/person/employment_history./business/employment_tenure/title', '.gov']]"
144,1126,4516.json,False,Says President Barack Obama failed to stand up for the bipartisan debt solutions of the SimpsonBowles Commission.,"[['Barack Obama', 'people/person/employment_history./business/employment_tenure/title', 'President']]"
145,1127,1914.json,False,"Phoenix, Arizona, Im told, is now the No. 2 kidnapping capital in the world, right behind Mexico City.","[['City', 'location/country/languages_spoken', 'Mexico']]"
146,1128,2761.json,False,Congresswoman Kathy Castor voted to spend 2.6 million to teach prostitutes in China to drink responsibly.,"[['Kathy Castor', 'people/person/employment_history./business/employment_tenure/title', 'Member of Congress']]"
147,1130,242.json,True,"As governor, Mike Huckabee supported higher income taxes, sales taxes, gas taxes, grocery taxes, tobacco taxes, beer taxes, Internet taxes, nursing home bed taxes.","[['Mike Huckabee', 'people/person/employment_history./business/employment_tenure/title', 'Governor']]"
148,1147,10033.json,False,Says U.S. Rep. Steve Southerland voted himself health care for life.,"[['Steve Southerland (Florida politician)', 'people/person/employment_history./business/employment_tenure/title', 'REP']]"
149,1158,8772.json,False,"Oregon Rep. Tina Kotek, DPortland, has never held a job nor run a business","[['Tina Kotek', 'people/person/employment_history./business/employment_tenure/title', 'REP']]"
150,1160,461.json,True,The Rev. Wright compared the United States Marine Corps with Roman legionnaires who were responsible for the death of our Savior.,"[['Wright', 'organization/role/leaders./organization/leadership/person', 'United States Marine Corps'], ['Wright', 'people/person/employment_history./business/employment_tenure/title', 'Rødrev']]"
151,1161,12280.json,True,Says Nevada state Sen. Michael Roberson forced Common Core for Nevada schools.,"[['Michael Roberson', 'people/person/employment_history./business/employment_tenure/title', 'State senator']]"
152,1167,10339.json,True,"Says that in 2008, President Barack Obama said normalization with Cuba would first require liberation of all political prisoners and some basic steps toward freedom, including freedom of the press, political parties, labor unions.","[['Barack Obama', 'people/person/employment_history./business/employment_tenure/title', 'President']]"
153,1195,9871.json,False,"ISIS is right now crucifying Christians in Iraq, literally nailing Christians to trees.","[['Den islamske staten Irak og Levanten', 'organization/organization/headquarters./location/mailing_address/country', 'Iraq'], ['Den islamske staten Irak og Levanten', 'organization/organization/headquarters./location/mailing_address/country', 'Iraq'], ['Den islamske staten Irak og Levanten', 'organization/organization/headquarters./location/mailing_address/country', 'Iraq']]"
154,1211,2140.json,True,There are more pain clinics in Broward County than there are McDonalds in Broward County.,"[[""McDonald's"", 'organization/organization/headquarters./location/mailing_address/country', 'Broward County']]"
155,1214,9608.json,False,Former President George W. Bush and former Vice President Dick Cheney are unable to visit Europe due to outstanding warrants.,"[['George W. Bush', 'people/person/employment_history./business/employment_tenure/title', 'President'], ['Dick Cheney', 'people/person/employment_history./business/employment_tenure/title', 'Vice President of the United States']]"
156,1226,5016.json,False,"Says Rep. Betty Sutton supports allowing welfare fund withdrawals from strip clubs, casinos and liquor stores.","[['Betty Sutton', 'people/person/employment_history./business/employment_tenure/title', 'REP']]"
157,1233,14.json,True,Senator McCain voted against the Bush tax cuts. Now hes for them.,"[['John McCain', 'people/person/employment_history./business/employment_tenure/title', 'Senator']]"
158,1237,12965.json,True,"In Congress, Cresent Hardy voted to defund DACA.","[['200', 'organization/role/leaders./organization/leadership/person', 'United States Congress'], ['200', 'organization/role/leaders./organization/leadership/person', 'United States Congress']]"
159,1241,1678.json,True,"President Obama himself attempted to filibuster Justice Alito, who now sits on the Supreme Court.","[['Barack Obama', 'people/person/employment_history./business/employment_tenure/title', 'President']]"
160,1249,3001.json,False,The Greenest County in America.,"[['200', 'location/country/languages_spoken', 'United States']]"
161,1277,1564.json,False,George W. Bush was the least popular president in modern history.,"[['George W. Bush', 'people/person/employment_history./business/employment_tenure/title', 'President']]"
162,1299,10440.json,True,"Since Gov. Nathan Deal office in 2011, the states rainy day fund has grown by 643 percent.","[['Nathan Deal', 'people/person/employment_history./business/employment_tenure/title', '.gov']]"
163,1300,6647.json,False,Says President Barack Obama built this 16 trillion debt.,"[['Barack Obama', 'people/person/employment_history./business/employment_tenure/title', 'President']]"
164,1305,12550.json,True,"Says Michael Bennet votes for President Obamas agenda 98 percent of the time. Hardly independent, hardly bipartisan.","[['Barack Obama', 'people/person/employment_history./business/employment_tenure/title', 'President']]"
165,1307,661.json,False,John McCain wants to privatize Social Security.,"[['John McCain', 'organization/role/leaders./organization/leadership/person', 'Social Security (United States)']]"
166,1326,5270.json,True,Congressman Phil Roe hands out 1.3M government check from a federal program that he voted against.,"[['Phil Roe (politician)', 'people/person/employment_history./business/employment_tenure/title', 'Member of Congress']]"
167,1338,4378.json,False,"U.S. Reps. Hank Johnson, John Lewis and other members of the Congressional Progressive Caucus are socialists who are openly serving in the U.S. Congress.","[['United States Congress', 'organization/organization/headquarters./location/mailing_address/country', 'Us (2019 film)']]"
168,1353,5139.json,True,"Mayor Barrett saved Milwaukee 25 million, thanks to Gov. Walkers reforms.","[['Barrett M82', 'people/person/employment_history./business/employment_tenure/title', 'Mayor']]"
169,1374,8740.json,True,State Rep. Kathleen Peters has a 100 percent proabortion voting record even voting against a ban on sexselection abortions.,"[['Kathleen Peters', 'people/person/employment_history./business/employment_tenure/title', 'United States House of Representatives']]"
170,1378,5973.json,False,"Obamas flush with cash, returning to Wall Street for even more money. Wall Street sure supports President Obama.","[['Barack Obama', 'people/person/employment_history./business/employment_tenure/title', 'President']]"
171,1390,3348.json,True,DeKalb County has cut more money from its general fund budget than any local government in the Atlanta metro region.,"[['County', 'location/hud_county_place/county', 'DeKalb (Illinois)']]"
172,1391,5784.json,False,"Says Gov. Scott Walker signed abortion, sex education and discrimination bills in secret.","[['Scott Walker (sanger)', 'people/person/employment_history./business/employment_tenure/title', '.gov']]"
173,1394,2870.json,False,"Eighty percent of the oil were discovering, were discovering in the deep Gulf of Mexico.","[['List of gulfs', 'location/country/languages_spoken', 'Mexico']]"
174,1411,2178.json,True,"In 2009, the Small Business Entrepreneurship Council ranked Ohio 11th in the nation and 1st in the Midwest for overall business climate.","[['200', 'organization/organization/headquarters./location/mailing_address/country', 'Midwestern United States']]"
175,1421,4114.json,True,"Our countrys got this huge debt, and President Barack Obama says raise taxes and keep spending more.","[['Barack Obama', 'people/person/employment_history./business/employment_tenure/title', 'President']]"
176,1430,8079.json,True,President Barack Obama has announced that he would not sign ANY spending bills this year unless sequestration spending cuts are eliminated.,"[['Barack Obama', 'people/person/employment_history./business/employment_tenure/title', 'President']]"
177,1439,3423.json,True,Oil production from federal waters in the Gulf of Mexico reached an alltime high in 2010.,"[['List of gulfs', 'location/country/languages_spoken', 'Mexico']]"
178,1443,554.json,True,The legislation ... that Senator McCain supports would provide the authority for the federal government to surveille American citizens in their own country without any suspicion whatsoever that theyre engaging in discussions with terrorists or about criminal activity.,"[['John McCain', 'people/person/employment_history./business/employment_tenure/title', 'Senator']]"
179,1448,8569.json,False,"In Jeanne Shaheen, New Hampshire has a Senator who was the deciding vote to pass Obamacare.","[['New Hampshire', 'people/person/employment_history./business/employment_tenure/title', 'Jeanne Shaheen']]"
180,1451,4529.json,False,Says Gov. Chris Christie has now come up with a new agenda for ethics reform in September 2011.,"[['Chris Christie', 'people/person/employment_history./business/employment_tenure/title', '.gov']]"
181,1453,4786.json,False,"Gov. Scott Walker received a 7,300 pay raise.","[['Scott Walker (sanger)', 'people/person/employment_history./business/employment_tenure/title', '.gov']]"
182,1455,12068.json,True,"Says when Bernie Sanders was in college, Sanders said something very similar to what conservative Wisconsin Supreme Court Justice Rebecca Bradley had written as a college student in the 1990s  that women have a legitimate role in date rape.","[['Rebecca Bradley (judge)', 'organization/role/leaders./organization/leadership/person', 'Wisconsin Supreme Court']]"
183,1456,9848.json,False,Says Michigan U.S. Senate candidateTerri Lynn Land said guaranteeing equal pay for women who do the same job as men is not a good idea.,"[['Terri Lynn Land', 'organization/role/leaders./organization/leadership/person', 'List of United States senators from Michigan'], ['Terri Lynn Land', 'organization/role/leaders./organization/leadership/person', 'List of United States senators from Michigan']]"
184,1463,9950.json,False,Says President Barack Obama is sending a much larger force to deal with Ebola than ISIS is getting.,"[['Barack Obama', 'people/person/employment_history./business/employment_tenure/title', 'President']]"
185,1464,6369.json,True,Says U.S. Senate opponent Eric Hovde supported billions in stimulus for highspeed rail and billions more to bail out banks.,"[['200', 'organization/role/leaders./organization/leadership/person', 'USAs senat']]"
186,1466,912.json,False,U.S. Senate Majority Leader Harry Reid on whether Senate Democrats would seat Roland Burris.,"[['Harry Reid', 'organization/role/leaders./organization/leadership/person', 'USAs senat'], ['Harry Reid', 'people/person/employment_history./business/employment_tenure/title', 'Leadership']]"
187,1477,13489.json,False,"Says climate scientist James Hansen says we have until perhaps 50 years from now, or maybe a little longer and at that point, we are looking at 10, 20, 30 feet of sealevel rise.","[['James Hansen', 'people/person/employment_history./business/employment_tenure/title', 'Scientist']]"
188,1481,6145.json,False,Says GOP U.S. Rep. Sean Duffy of Wisconsin voted twice to end Medicare.,"[['Sean Duffy', 'people/person/employment_history./business/employment_tenure/title', 'REP'], ['Sean Duffy', 'organization/role/leaders./organization/leadership/person', 'Det republikanske parti (USA)']]"
