,index,id,label,text,triple
189,1504,3208.json,True,Joe Straus is the first Jewish speaker of the Texas House.,"[['Joe Straus', 'organization/role/leaders./organization/leadership/person', 'Texas House of Representatives'], ['Joe Straus', 'organization/role/leaders./organization/leadership/person', 'Texas House of Representatives'], ['Joe Straus', 'organization/role/leaders./organization/leadership/person', 'Texas House of Representatives'], ['Joe Straus', 'organization/role/leaders./organization/leadership/person', 'Texas House of Representatives']]"
190,1531,4167.json,True,Says state Rep. Fred Clark DBaraboo ran a red light and seriously injured a bicyclist.,"[['Fred Clark (politician)', 'people/person/employment_history./business/employment_tenure/title', 'United States House of Representatives']]"
191,1535,9506.json,True,Says Scott Brown voted with President Barack Obama 70 percent of the time in 2011.,"[['Barack Obama', 'people/person/employment_history./business/employment_tenure/title', 'President'], ['Scott Brown (fotballspiller)', 'people/person/employment_history./business/employment_tenure/title', 'Barack Obama']]"
192,1542,3877.json,True,Says six of the states 58 family planning centers had to close because of Gov. Chris Christies budget cuts.,"[['Chris Christie', 'people/person/employment_history./business/employment_tenure/title', '.gov']]"
193,1551,9314.json,False,Says Rep. Justin Amash votes more with the Democrats than with the Republicans.,"[['Justin Amash', 'people/person/employment_history./business/employment_tenure/title', 'REP']]"
194,1556,3983.json,True,"Says MiamiDade mayoral candidate Julio Robaina has the highest salary among Florida mayors. More than 260,000.","[['Julio Robaina', 'people/person/employment_history./business/employment_tenure/title', 'Candidate']]"
195,1567,4630.json,False,Says Barack Obama never worked in the private sector before he was elected president.,"[['Barack Obama', 'people/person/employment_history./business/employment_tenure/title', 'President']]"
196,1572,1575.json,True,House Appropriations Chair David Obeys partial earmark ban wouldnt apply to 90 of earmarks.,"[['Dave Obey', 'organization/role/leaders./organization/leadership/person', 'House M.D.']]"
197,1578,2017.json,True,"As a senator, Barack Obama supported an amendment that basically gutted the legal temporary worker program.","[['Barack Obama', 'people/person/employment_history./business/employment_tenure/title', 'Senator']]"
198,1580,12260.json,False,"While Mayor Kenney personally doesnt support DROP, he cant fault highly qualified city employees for appropriately utilizing a benefit thats available to them.","[['200', 'people/person/employment_history./business/employment_tenure/title', 'Mayor']]"
199,1585,12883.json,False,Says Gov. Rick Scott cut nearly 1 million from mosquito control and closed down the states mosquito research lab a few years ago.,"[['Rick Scott', 'people/person/employment_history./business/employment_tenure/title', '.gov']]"
200,1586,4487.json,False,Says Wisconsin Gov. Scott Walker is denying Democrats the right to vote.,"[['Scott Walker (sanger)', 'people/person/employment_history./business/employment_tenure/title', '.gov']]"
201,1588,1956.json,False,"When George Bush took office, President Clinton, a Democrat, and the Democratic Congress at the time had left an annual budget that was in surplus.","[['Bill Clinton', 'people/person/employment_history./business/employment_tenure/title', 'President']]"
202,1606,5161.json,True,"In campaigns in the past with Sen. McCain and President George W. Bush and others, they have tended to release tax records in April.","[['George W. Bush', 'people/person/employment_history./business/employment_tenure/title', 'President']]"
203,1612,6314.json,False,Gov. Bill Haslam is making our Economic Development department Sharia compliant by hiring a woman who specializes in Sharia compliance. Thats what her job is.,"[['Bill Haslam', 'people/person/employment_history./business/employment_tenure/title', '.gov']]"
204,1618,11099.json,False,President Barack Obama said at the beginning of the negotiations that the basic approach was to dismantle Irans nuclear program in exchange for dismantling the sanctions.,"[['Barack Obama', 'people/person/employment_history./business/employment_tenure/title', 'President']]"
205,1623,1715.json,True,"By the end of Governor Rick Perrys term, he will have drained Texas taxpayers ... of more than 360,000 to pay for the rental mansion he has been living in while the historic Governors Mansion is repaired.","[['Rick Perry', 'people/person/employment_history./business/employment_tenure/title', 'Governor']]"
206,1625,4988.json,True,Says President Obama helped more than half a million veterans and military family members go to college through the Post911 G.I. Bill.,"[['Barack Obama', 'people/person/employment_history./business/employment_tenure/title', 'President']]"
207,1626,4082.json,True,"In our proposal, we would have expanded school aid across the board Governor Christie slashed school aid in this budget, preferring instead to extend a tax break for millionaires over funding in the classroom.","[['Wilhelm Frimann Koren Christie', 'people/person/employment_history./business/employment_tenure/title', 'Governor']]"
208,1638,1929.json,False,Bill McCollum served as a lobbyist whose clients enabled mortgages for illegal immigrants.,"[['Bill McCollum', 'people/person/employment_history./business/employment_tenure/title', 'Lobbyist']]"
209,1641,5961.json,False,Says Gov. Scott Walker is cooking the books by releasing numbers he just dreamed up that show Wisconsin gained jobs in 2011.,"[['Scott Walker (sanger)', 'people/person/employment_history./business/employment_tenure/title', '.gov']]"
210,1648,7104.json,False,"In one county alone in Ohio, President Obama received 106,258 votes. But there were only 98,213 eligible voters.","[['Barack Obama', 'people/person/employment_history./business/employment_tenure/title', 'President']]"
211,1651,9344.json,False,Says Mark Begich has taken campaign cash from the Kochs while Dan Sullivan hasnt.,"[['Mark Begich', 'organization/role/leaders./organization/leadership/person', 'Kochs postulat']]"
212,1657,6563.json,False,"Household income in America has gone down for families an average of 4,000 in the last four years while it went up 5,000 under Mitt Romney when he was governor of Massachusetts","[['Mitt Romney', 'people/person/employment_history./business/employment_tenure/title', 'Governor'], ['Mitt Romney', 'people/person/employment_history./business/employment_tenure/title', 'Massachusetts']]"
213,1694,9634.json,False,"Compared to President Obama,President Reagan rushed home from Santa Barbara vacation, from the Reagan ranch when the Korean jetliner was shot out of the air by the Russians.","[['Ronald Reagan', 'people/person/employment_history./business/employment_tenure/title', 'President'], ['Ronald Reagan', 'people/person/employment_history./business/employment_tenure/title', 'Barack Obama'], ['Ronald Reagan', 'people/person/employment_history./business/employment_tenure/title', 'Barack Obama'], ['Barack Obama', 'people/person/employment_history./business/employment_tenure/title', 'President']]"
214,1704,1538.json,False,"In 2001, former Federal Reserve chairman Alan Greenspan justified increasing spending and cutting taxes, saying that we didnt really need to pay down the debt.","[['Alan Greenspan', 'people/person/employment_history./business/employment_tenure/title', 'Chairperson'], ['Alan Greenspan', 'organization/role/leaders./organization/leadership/person', 'Federal Reserve']]"
215,1705,9623.json,True,DeKalb County has been recognized in recent years as having one the best sheriffs departments in the nation.,"[['County', 'location/hud_county_place/county', 'DeKalb (Illinois)']]"
216,1710,4523.json,True,Members of the public are being charged 50 to hear Gov. Scott Walker and a dozen members of his administration talk about jobs and the economy at Lambeau Field.,"[['Scott Walker (sanger)', 'people/person/employment_history./business/employment_tenure/title', '.gov']]"
217,1722,903.json,False,The Rev. Rick Warren has called Christians who advance a social gospel Marxists.,"[['Rick Warren', 'people/person/employment_history./business/employment_tenure/title', 'Rødrev']]"
218,1732,10588.json,True,President Obama said 22 times he could not authorize immigration reform by executive order.,"[['Barack Obama', 'people/person/employment_history./business/employment_tenure/title', 'President']]"
219,1733,1902.json,True,Right now every single one of the oil companies here today and dozens of others are drilling for free in the Gulf of Mexico on leases that will cost American taxpayers more than 50 billion in lost royalties.,"[['List of gulfs', 'location/country/languages_spoken', 'Mexico']]"
220,1752,7485.json,True,"Under Gov. John Kasichs budget proposal, the top one percent in Ohio will pay 10,000 less in income tax each year, but Ohios working and middle class families will pay more.","[['John Kasich', 'people/person/employment_history./business/employment_tenure/title', '.gov']]"
221,1753,1740.json,True,The Treaty of Tripoli signed by President John Adams was his outreach to Muslims.,"[['John Adams', 'people/person/employment_history./business/employment_tenure/title', 'President']]"
222,1760,6716.json,False,Medicare premium support backed by Republican vice presidential candidate Paul Ryan is not vouchers.,"[['Paul Ryan', 'people/person/employment_history./business/employment_tenure/title', 'Candidate']]"
223,1763,1925.json,True,The addition of a 1 percent sales tax would cost a typical household in Hillsborough County approximately 12 a month.,"[['County', 'location/hud_county_place/county', 'Hillsborough-tragedien']]"
224,1771,3765.json,False,Says there are more federal dollars in Gov. John Kasichs budget plan than in the previous state budget.,"[['John Kasich', 'people/person/employment_history./business/employment_tenure/title', '.gov']]"
225,1775,2762.json,False,Congressman Nye voted against a bill which would have defunded the 510 billion the IRS needed toimplement health care legislation.,"[['200', 'people/person/employment_history./business/employment_tenure/title', 'Member of Congress']]"
226,1776,4213.json,False,"In contrast to President Barack Obama, who is not acting presidential, President Ronald Reagan would never go into the Oval Office without his jacket on thats how much he revered the presidency.","[['Barack Obama', 'people/person/employment_history./business/employment_tenure/title', 'President'], ['Ronald Reagan', 'people/person/employment_history./business/employment_tenure/title', 'Det ovale kontor'], ['Ronald Reagan', 'people/person/employment_history./business/employment_tenure/title', 'President']]"
227,1784,8770.json,True,"Trey Radel does not even qualify to drive a Lee County school bus at this point, yet he occupies a seat in Congress.","[['Trey Radel', 'organization/role/leaders./organization/leadership/person', 'United States Congress']]"
228,1792,9541.json,False,"As Alaskas attorney general, U.S. Senate candidate Dan Sullivan successfully fought to protect our Second Amendment rights and passed stand your ground.","[['Dan Sullivan', 'organization/role/leaders./organization/leadership/person', 'USAs senat'], ['USAs senat', 'organization/organization/headquarters./location/mailing_address/country', 'Us (2019 film)'], ['Dan Sullivan', 'people/person/employment_history./business/employment_tenure/title', 'Candidate']]"
229,1804,1000.json,False,"In the 1970s, the swine flu broke out . . . under another Democrat, President Jimmy Carter.","[['Jimmy Carter', 'people/person/employment_history./business/employment_tenure/title', 'President']]"
230,1806,684.json,True,Gov. Palin ... is somebody who actually doesnt believe that climate change is manmade.,"[['Michael Palin', 'people/person/employment_history./business/employment_tenure/title', '.gov']]"
231,1808,5988.json,True,"While Act 10 allowed Milwaukee County to save some money, it was millions short of what we needed to fill the hole left by the 28 million cut in state aid.","[['County', 'location/hud_county_place/county', 'Milwaukee']]"
232,1813,1161.json,True,"Since World War II, only Gerald Ford and Bill Clinton have had worse ratings after seven months than President Obama.","[['Barack Obama', 'people/person/employment_history./business/employment_tenure/title', 'President'], ['Bill Clinton', 'people/person/employment_history./business/employment_tenure/title', 'Barack Obama'], ['Gerald Ford', 'people/person/employment_history./business/employment_tenure/title', 'Barack Obama']]"
233,1829,6439.json,True,Says U.S. Senate rival Eric Hovde refused to pay his property taxes until he was taken to court.,"[['200', 'organization/role/leaders./organization/leadership/person', 'USAs senat']]"
234,1838,811.json,False,Senator McCain would pay for part of his health care plan by making drastic cuts in Medicare 882billion worth.,"[['John McCain', 'people/person/employment_history./business/employment_tenure/title', 'Senator']]"
235,1841,10405.json,False,President Barack Obamas policies have resulted in gas prices being reduced from 3.07 per gallon when he was sworn in in 2009 to 2.30 today.,"[['Barack Obama', 'people/person/employment_history./business/employment_tenure/title', 'President']]"
236,1848,9414.json,False,Congresswoman RosLehtinen has long record of voting against VA backlog fixes.,"[['Ileana Ros-Lehtinen', 'people/person/employment_history./business/employment_tenure/title', 'Member of Congress']]"
237,1850,6118.json,False,"Says that under President Obama, theres been a substantial increase in federal government jobs.","[['Barack Obama', 'people/person/employment_history./business/employment_tenure/title', 'President']]"
238,1865,7551.json,True,"Under Gov. Kasich, Ohio wages have increased by 10.3 billion.","[['John Kasich', 'people/person/employment_history./business/employment_tenure/title', '.gov']]"
239,1872,12795.json,False,"Just on the issue of immigration alone, it is next to impossible to find a policy difference between Donald Trump and Congressman Joe Heck.","[['Joe Heck', 'people/person/employment_history./business/employment_tenure/title', 'Member of Congress']]"
240,1888,6144.json,True,Atlanta Tea Party cofounder Debbie Dooley wants gas taxes raised.,"[['200', 'organization/role/leaders./organization/leadership/person', '200']]"
241,1896,690.json,True,Governor Palin is the most popular governor in the country.,"[['Michael Palin', 'people/person/employment_history./business/employment_tenure/title', 'Governor'], ['Michael Palin', 'people/person/employment_history./business/employment_tenure/title', 'Governor']]"
242,1901,4330.json,True,Says Gov. Rick Scott cut state funding for PBS.,"[['Rick Scott', 'organization/role/leaders./organization/leadership/person', 'PBS'], ['Rick Scott', 'people/person/employment_history./business/employment_tenure/title', '.gov']]"
243,1902,9712.json,True,Attorney General Eric Holders own Justice Department precleared the voting changes in the 2011 law about early voting in Florida.,"[['Eric Holder', 'people/person/employment_history./business/employment_tenure/title', 'United States Attorney General']]"
244,1908,10178.json,False,Attorney general candidate Brad Schimel is in cahoots with Wisconsin Right to Life to make abortion a crime in Wisconsin.,"[['Brad Schimel', 'people/person/employment_history./business/employment_tenure/title', '2018 New York Attorney General election']]"
245,1910,7992.json,True,Economic Development Commission Executive Director Keith Stokes sent me a letter and he said the taxpayers will never be on the hook for these bonds for 38 Studios.,"[['Keith Stokes', 'people/person/employment_history./business/employment_tenure/title', 'Executive director'], ['Keith Stokes', 'organization/role/leaders./organization/leadership/person', '200']]"
246,1935,10990.json,False,Says Barack Obama told the U.S. Coast Guard Academy that the number one threat to the military and the world today is global warming.,"[['Barack Obama', 'organization/role/leaders./organization/leadership/person', 'U.S. Coast Guard Academy']]"
247,1936,10519.json,False,Says awardwinning Milwaukee Public Schools teacher Megan Sampson was laid off because Gov. Scott Walker cut state aid to education.,"[['200', 'people/person/employment_history./business/employment_tenure/title', 'Teacher'], ['200', 'organization/role/leaders./organization/leadership/person', 'Milwaukee Public Schools'], ['Scott Walker (sanger)', 'people/person/employment_history./business/employment_tenure/title', '.gov']]"
248,1944,9499.json,False,"Says President Barack Obama said when we got bin Laden, terrorism problem solved.","[['Barack Obama', 'people/person/employment_history./business/employment_tenure/title', 'President']]"
249,1950,6856.json,False,If Gov. Romneys plan goes into effect the average senior would have to pay 460 a year more in tax for their Social Security.,"[['Mitt Romney', 'people/person/employment_history./business/employment_tenure/title', '.gov']]"
250,1961,7625.json,True,Pasco County has the second highest population of homeless in all of Florida.,"[['County', 'location/hud_county_place/county', 'Pasco']]"
251,1966,6666.json,True,"Says President Barack Obama gives students the right to repay federal loans as a clear, fixed, low percentage of their income for up to 20 years.","[['Barack Obama', 'people/person/employment_history./business/employment_tenure/title', 'President']]"
252,1978,1920.json,False,Georgia Secretary of State Brian Kemp is a career politician.,"[['Brian Kemp', 'people/person/employment_history./business/employment_tenure/title', 'United States Secretary of State']]"
253,1982,6960.json,True,President Barack Obama is the first president in history to cut Medicare by 700 billion.,"[['Barack Obama', 'people/person/employment_history./business/employment_tenure/title', 'President']]"
254,1989,11086.json,True,The actual deportations from the interior of the country are way down under President Obama.,"[['Barack Obama', 'people/person/employment_history./business/employment_tenure/title', 'President']]"
255,1992,3763.json,True,"On taxes, President Barack Obama wants to raise the top rate to 44.8 percent.","[['Barack Obama', 'people/person/employment_history./business/employment_tenure/title', 'President']]"
256,2015,5879.json,False,Says that Rep. Betty Sutton would rather riot with Occupy Wall Street than stand up for Ohio families.,"[['Betty Sutton', 'people/person/employment_history./business/employment_tenure/title', 'REP']]"
257,2019,2153.json,True,"Says President Barack Obama initially said the national healthcare mandate isnt a tax, but his administration now says it is a tax.","[['Barack Obama', 'people/person/employment_history./business/employment_tenure/title', 'President']]"
258,2020,9113.json,True,There are still more people uninsured today than when Obama was elected president.,"[['Barack Obama', 'people/person/employment_history./business/employment_tenure/title', 'President']]"
259,2024,5351.json,False,You cant pass a budget in the Senate of the United States without 60 votes.,"[['USAs senat', 'organization/organization/headquarters./location/mailing_address/country', 'United States']]"
260,2030,350.json,False,Barack Obama said hes going to attack Pakistan and embrace Iranian President Mahmoud Ahmadinejad.,"[['Pakistan', 'people/person/nationality', 'Mahmoud Ahmadinejad'], ['Pakistan', 'people/person/employment_history./business/employment_tenure/title', 'Mahmoud Ahmadinejad'], ['Mahmoud Ahmadinejad', 'people/person/employment_history./business/employment_tenure/title', 'President']]"
261,2038,5204.json,True,President Obama has said he is going to cut veterans benefits.,"[['Barack Obama', 'people/person/employment_history./business/employment_tenure/title', 'President']]"
262,2047,12797.json,False,"In 2009, his first year as mayor, Julin Castro received a sevenfigure referral fee that smells like a dirty financial gift from notorious personal injury lawyer Mikal Watts, a major Obama donor.","[['Mikal Watts', 'people/person/employment_history./business/employment_tenure/title', 'Lawyer']]"
263,2072,11193.json,True,"Emails released to the public show Hillary Clinton discussed the location of Ambassador Stevens, who of course was murdered, in Libya.","[['Hillary Clinton', 'people/person/employment_history./business/employment_tenure/title', 'Stevens'], ['Stevens', 'people/person/employment_history./business/employment_tenure/title', 'Ambassadør']]"
264,2078,9976.json,True,Says President Barack Obama has launched twice as many strikes oncountries that are predominantly Muslim than President George W. Bush.,"[['George W. Bush', 'people/person/employment_history./business/employment_tenure/title', 'President'], ['Barack Obama', 'people/person/employment_history./business/employment_tenure/title', 'President']]"
265,2083,11637.json,True,"The Milwaukee County executive can sell the public museum, the airport and the zoo  all on his own, without County Board approval","[['County', 'location/hud_county_place/county', 'Milwaukee']]"
266,2099,8397.json,False,A 10 million fire fee proposal in St. Petersburg was inspired by Gov. Rick Scott.,"[['Rick Scott', 'people/person/employment_history./business/employment_tenure/title', '.gov']]"
267,2105,1032.json,True,Judge Sotomayor has said that policy is made on the U.S. Court of Appeals.,"[['Javier Sotomayor', 'people/person/employment_history./business/employment_tenure/title', 'Judge']]"
268,2117,3014.json,True,I never proposed privatizing the Milwaukee County airport.,"[['County', 'location/hud_county_place/county', 'Milwaukee']]"
269,2125,5715.json,False,President Barack Obama has doubled the size of government since he took office.,"[['Barack Obama', 'people/person/employment_history./business/employment_tenure/title', 'President']]"
270,2150,3241.json,True,Senator Webb was a reliable vote for President Obama and Senator Harry Reid.,"[['Barack Obama', 'people/person/employment_history./business/employment_tenure/title', 'President'], ['James E. Webb', 'people/person/employment_history./business/employment_tenure/title', 'Barack Obama'], ['Harry Reid', 'people/person/employment_history./business/employment_tenure/title', 'Senator'], ['James E. Webb', 'people/person/employment_history./business/employment_tenure/title', 'Barack Obama'], ['James E. Webb', 'people/person/employment_history./business/employment_tenure/title', 'Senator']]"
271,2160,4765.json,True,"In Wisconsin, Gov. Scott Walker has created a manufacturingled jobs recovery. 30,000 new jobs were created this year, with 15,000 created in the struggling manufacturing sector.","[['Scott Walker (sanger)', 'people/person/employment_history./business/employment_tenure/title', 'Wisconsin'], ['Scott Walker (sanger)', 'people/person/employment_history./business/employment_tenure/title', '.gov']]"
272,2163,8453.json,False,"Congress, criminals, Scientologists and other groups are exempt from Obamacare.","[['United States Congress', 'organization/organization/headquarters./location/mailing_address/country', 'Patient Protection and Affordable Care Act']]"
273,2165,10203.json,True,Ill be the only economist in the U.S. House.,"[['House M.D.', 'organization/organization/headquarters./location/mailing_address/country', 'Us (2019 film)'], ['Ill', 'organization/organization/headquarters./location/mailing_address/country', 'House M.D.'], ['Ill', 'organization/organization/headquarters./location/mailing_address/country', 'House M.D.']]"
274,2170,11514.json,False,"Says Ohio Gov. John Kasich got lucky with a thing called fracking, which is why Ohio is doing well.","[['John Kasich', 'people/person/employment_history./business/employment_tenure/title', '.gov']]"
275,2184,11759.json,True,Says President Barack Obama appointed Eric Holder as attorney general. Eric Holder said he viewed his mission as brainwashing the American people against guns.,"[['Barack Obama', 'people/person/employment_history./business/employment_tenure/title', 'United States Attorney General'], ['Barack Obama', 'people/person/employment_history./business/employment_tenure/title', 'Eric Holder'], ['Barack Obama', 'people/person/employment_history./business/employment_tenure/title', 'President']]"
276,2201,9710.json,False,"So many people were critical of Secretary John Kerry going to Paris and talking with Hamas, because Kerry was seen as supporting Hamas to the exclusion of the Arab League.","[['John Kerry', 'organization/role/leaders./organization/leadership/person', 'Hamas'], ['John Kerry', 'people/person/employment_history./business/employment_tenure/title', 'Secretary']]"
277,2204,1973.json,False,A transcript released by Occidental College proves that Barack Obama was an Indonesian citizen.,"[['Barack Obama', 'people/person/nationality', 'Indonesia']]"
278,2218,3907.json,False,Says U.S. Rep. Paul Ryan promised to end health care for our seniors.,"[['Paul Ryan', 'people/person/employment_history./business/employment_tenure/title', 'REP']]"
279,2228,5615.json,True,Says he and President Barack Obama have the same position on gay marriage.,"[['Barack Obama', 'people/person/employment_history./business/employment_tenure/title', 'President']]"
280,2231,10288.json,True,Says President Barack Obama has lost more members of the House and more members of the Senate than any president ever has lost in modern times.,"[['Barack Obama', 'people/person/employment_history./business/employment_tenure/title', 'President']]"
281,2232,3143.json,True,President Barack Obama supports immigration amnesty.,"[['Barack Obama', 'people/person/employment_history./business/employment_tenure/title', 'President']]"
